{
  "highlight_id": "h_001",
  "video_id": "v_001",
  "start_time": 38.0,
  "end_time": 46.0,
  "highlight_type": "身份揭露",
  "emotion": "震惊",
  "intensity": 0.92,
  "summary": "男主真实身份曝光，反派震惊。",
  "reason": "前文一直铺垫男主被轻视，此处身份反转带来强爽点。",
  "confidence": 0.88,
  "highlight_score": 0.86,
  "status": "verified",
  "created_at": "2026-05-20T09:00:00Z",
  "updated_at": "2026-05-20T09:00:00Z"
}
